### ISSUE TITLE
connection closed: Error: read ECONNRESET

### ISSUE THREAD

**Issue by rolf-achim** [ioBroker/ioBroker.mqtt#378]
After the MQTT client has established a connection to the MQTT adapter and published a message, the connection is closed with the info message:
connection closed: Error: read ECONNRESET

I have checked the network packages going back and forth, and the package causing the error is the last network package in the communication. This package has the Reset-Flag set:

Transmission Control Protocol, Src Port: 38059, Dst Port: 1883, Seq: 66, Ack: 5, Len: 0
    Source Port: 38059
    Destination Port: 1883
    [Stream index: 2]
    [Conversation completeness: Complete, WITH_DATA (47)]
    [TCP Segment Len: 0]
    Sequence Number: 66    (relative sequence number)
    Sequence Number (raw): 17027469
    [Next Sequence Number: 66    (relative sequence number)]
    Acknowledgment Number: 5    (relative ack number)
    Acknowledgment number (raw): 2136262602
    0101 .... = Header Length: 20 bytes (5)
    Flags: 0x014 (RST, ACK)
        000. .... .... = Reserved: Not set
        ...0 .... .... = Nonce: Not set
        .... 0... .... = Congestion Window Reduced (CWR): Not set
        .... .0.. .... = ECN-Echo: Not set
        .... ..0. .... = Urgent: Not set
        .... ...1 .... = Acknowledgment: Set
        .... .... 0... = Push: Not set
        .... .... .1.. = **Reset: Set**
        .... .... ..0. = Syn: Not set
        .... .... ...0 = Fin: Not set
        [TCP Flags: ·······A·R··]

Maybe the adapter is not able to handle this flag?

**Comment by rolf-achim** [comment]
After some more investigation, my conclusion is that the MQTT client I'm using isn't handling the connection properly. The paho client is sending a message with RST flag instead of a FIN flag for disconnecting the MQTT connection.
